{
  "blobs": [
    {
      "bytes": 5978,
      "key": "miniaturas/0161.jpg",
      "mime": "image/jpeg",
      "sha256": "343caffdafe5403673fedf01bff73b2f45de6d16b7190920a585462da01d2481"
    },
    {
      "bytes": 1158,
      "key": "original.txt",
      "mime": "text/plain; charset=utf-8",
      "sha256": "9717f18d744bda544047374251d24df7e3d8d908af31f96d15098321b8879542"
    }
  ],
  "document": {
    "authors": "Garcilaso de la Vega",
    "bytes": 3711038,
    "created": "2026-05-02T10:00:00.000Z",
    "duration": null,
    "id": "garcilaso",
    "kind": "scanned_pdf",
    "language": "es",
    "metadata": {
      "author": [
        {
          "family": "Garcilaso de la Vega"
        }
      ],
      "collection-title": "Colección Universal",
      "issued": {
        "date-parts": [
          [1919]
        ]
      },
      "language": "es",
      "original-date": {
        "date-parts": [
          [1543]
        ]
      },
      "publisher-place": "Madrid",
      "spdf": {
        "provenance": {
          "issued": {
            "confidence": 1,
            "source": "user"
          },
          "title": {
            "confidence": 1,
            "source": "reading"
          }
        }
      },
      "title": "Poesías",
      "type": "book"
    },
    "mime": "application/pdf",
    "rights": null,
    "source_ref": "blob:original.txt",
    "source_sha256": "3e807a32e66923b244ae6180aeb7be59825446181d5f5d106365bd16d345fde4",
    "title": "Poesías",
    "unit_count": 2,
    "updated": "2026-05-02T10:05:00.000Z",
    "year": 1919
  },
  "extensions": [],
  "figures": [
    {
      "anchor": {
        "region": {
          "h": 0.25,
          "w": 0.5,
          "x": 0.25,
          "y": 0
        },
        "type": "image"
      },
      "caption": null,
      "description": null,
      "id": "g-fig1",
      "image": "",
      "unit": "g-u1"
    }
  ],
  "fragments": [
    {
      "anchor": {
        "confidence": 0.9,
        "physical": 9,
        "printed": "7",
        "roman": false,
        "source": "inferred",
        "type": "page"
      },
      "anchor_end": null,
      "context": "Garcilaso, Égloga primera.",
      "id": "g-f1",
      "n": 1,
      "ord": 0,
      "search_text": "",
      "section": ["Égloga primera"],
      "text": "El dulce lamentar de dos pastores,\nSalicio juntamente y Nemoroso,\nhe de contar, sus quejas imitando;",
      "unit": "g-u1"
    },
    {
      "anchor": {
        "confidence": 1,
        "physical": 161,
        "printed": "159",
        "roman": false,
        "source": "read",
        "type": "page"
      },
      "anchor_end": null,
      "context": "Garcilaso, Soneto XXIII.",
      "id": "g-f2",
      "n": 2,
      "ord": 1,
      "search_text": "",
      "section": ["Soneto XXIII"],
      "text": "En tanto que de rosa y azucena\nse muestra la color en vuestro gesto,\ny que vuestro mirar ardiente, honesto,\nenciende el corazón y lo refrena,\ny en tanto que el cabello, que en la vena\ndel oro se escogió, con vuelo presto,\npor el hermoso cuello blanco, enhiesto,\nel viento mueve, esparce y desordena;\ncoged de vuestra alegre primavera\nel dulce fruto, antes que el tiempo airado\ncubra de nieve la hermosa cumbre.\nMarchitará la rosa el viento helado,\ntodo lo mudará la edad ligera,\npor no hacer mudanza en su costumbre.",
      "unit": "g-u2"
    }
  ],
  "fts": {
    "tokenizer": "unicode61 remove_diacritics 2",
    "trigram": false
  },
  "legacy": true,
  "meta": {
    "created": "2026-05-02T10:00:00.000Z",
    "generator": "scholaris-nube 2.0.0",
    "spdf_version": "4.1"
  },
  "provenance": [
    {
      "at": "2026-05-02T10:02:00.000Z",
      "detail": {
        "consultado": "2026-10-07",
        "edicion": "Poesías de Garcilaso de la Vega, Madrid, Calpe, 1919 (Colección Universal 83-84); Commons File:Poesías de Garcilaso de la Vega (1919).pdf, SHA-1 d5a1f893f42aee069a0a947e1dd554b3acbf5925",
        "paginas": [
          {
            "revision": 1288223,
            "titulo": "Página:Poesías de Garcilaso de la Vega (1919).pdf/9",
            "url": "https://es.wikisource.org/w/index.php?oldid=1288223"
          },
          {
            "revision": 1496717,
            "titulo": "Página:Poesías de Garcilaso de la Vega (1919).pdf/161",
            "url": "https://es.wikisource.org/w/index.php?oldid=1496717"
          }
        ]
      },
      "model": null,
      "ms": null,
      "provider": "wikisource",
      "stage": "lectura"
    },
    {
      "at": "2026-05-02T10:03:00.000Z",
      "detail": {
        "deducido": 1,
        "fuente": "etiquetas",
        "leido": 1
      },
      "model": null,
      "ms": 30,
      "provider": "etiquetas-pdf",
      "stage": "folios"
    }
  ],
  "sections": [
    {
      "id": "g-s1",
      "level": 1,
      "parent": null,
      "summary": null,
      "title": "Égloga primera",
      "unit_from": "g-u1",
      "unit_to": "g-u1"
    },
    {
      "id": "g-s2",
      "level": 1,
      "parent": null,
      "summary": null,
      "title": "Soneto XXIII",
      "unit_from": "g-u2",
      "unit_to": null
    }
  ],
  "spaces": [
    {
      "created": "2026-05-02T10:04:00.000Z",
      "dims": 4,
      "dtype": "f32",
      "id": "qwen3-vl-embedding-2b@4",
      "modalities": ["text", "image"],
      "model": "qwen3-vl-embedding-2b",
      "normalized": 1,
      "provider": "inferbox",
      "task_prefixes": null,
      "truncated_from": null,
      "version": null
    }
  ],
  "spdf_version": "4.1",
  "units": [
    {
      "anchor": {
        "confidence": 0.9,
        "physical": 9,
        "printed": "7",
        "roman": false,
        "source": "inferred",
        "type": "page"
      },
      "confidence": 1,
      "footer": null,
      "header": null,
      "id": "g-u1",
      "image": "u/42/d/garcilaso/paginas/0009.png",
      "notes": null,
      "ord": 1,
      "printed": "7",
      "reader": "wikisource",
      "t0": null,
      "t1": null,
      "text": "ÉGLOGA PRIMERA\n\nAL VISORREY DE NAPOLES\n\nSALICIO, NEMOROSO\n\nEl dulce lamentar de dos pastores,\nSalicio juntamente y Nemoroso,\nhe de contar, sus quejas imitando;\ncuyas ovejas al cantar sabroso\nestaban muy atentas, los amores,\nde pacer olvidadas, escuchando.\nTú, que ganaste obrando\nun nombre en todo el mundo,\ny un grado sin segundo;\nagora estés atento, sólo y dado\nal ínclito gobierno del estado\nalbano; agora vuelto a la otra parte,\nresplandeciente, armado,\nrepresentando en tierra el fiero Marte;\nagora de cuidados enojosos\ny de negocios libre, por ventura\nandes a caza el monte fatigando\nen ardiente jinete, que apresura\nel curso tras los ciervos temerosos,",
      "thumbnail": null,
      "words": null
    },
    {
      "anchor": {
        "confidence": 1,
        "physical": 161,
        "printed": "159",
        "roman": false,
        "source": "read",
        "type": "page"
      },
      "confidence": 1,
      "footer": null,
      "header": "159",
      "id": "g-u2",
      "image": null,
      "notes": null,
      "ord": 2,
      "printed": "159",
      "reader": "wikisource",
      "t0": null,
      "t1": null,
      "text": "mis ojos, y no pasan tan adentro\n\nque miren lo que el alma en sí contiene.\n\nY así, se quedan tristes en la puerta\n\nhecha por mi dolor, con esa mano\n\nque aun a su mismo pecho no perdona;\n\ndonde vi claro mi esperanza muerta;\n\ny el golpe que os hizo amor en vano\n\nnon esservi passato oltra la gonna.\n\nXXIII\n\nEn tanto que de rosa y azucena\n\nse muestra la color en vuestro gesto,\n\ny que vuestro mirar ardiente, honesto,\n\nenciende el corazón y lo refrena,\n\ny en tanto que el cabello, que en la vena\n\ndel oro se escogió, con vuelo presto,\n\npor el hermoso cuello blanco, enhiesto,\n\nel viento mueve, esparce y desordena;\n\ncoged de vuestra alegre primavera\n\nel dulce fruto, antes que el tiempo airado\n\ncubra de nieve la hermosa cumbre.\n\nMarchitará la rosa el viento helado,\n\ntodo lo mudará la edad ligera,\n\npor no hacer mudanza en su costumbre.\n\nXXIV\n\nA LA MARQUESA DE PADULA, DOÑA MARIA DE CARDONA\n\nIlustre honor del nombre de Cardona,\n\ndécima moradora de Parnaso,",
      "thumbnail": "blob:miniaturas/0161.jpg",
      "words": null
    }
  ],
  "vectors": {
    "qwen3-vl-embedding-2b@4": {
      "count": 3,
      "sha256": "cd1902fb47beaf3f64ff0975b22bbcbf922f4edde6cfbe22ccc96e259bb49660"
    }
  }
}
