{
  "blobs": [],
  "document": {
    "authors": "孔子",
    "bytes": 592,
    "created": "2026-10-07T00:00:00Z",
    "duration": null,
    "id": "lunyu",
    "kind": "document",
    "language": "lzh",
    "metadata": {
      "author": [
        {
          "literal": "孔子"
        }
      ],
      "language": "lzh",
      "note": "SPDF conformance document: Analects 1.1-1.4, 2.1 and 2.15, copied literally from Chinese Wikisource (論語/學而第一 and 論語/爲政第二). The original of this document is that plain-text excerpt; source_sha256 is its SHA-256.",
      "spdf": {
        "original_language": "lzh",
        "undated": {
          "basis": "compiled by the disciples of Confucius during the Warring States period",
          "from": -479,
          "to": -221
        }
      },
      "title": "論語",
      "type": "book"
    },
    "mime": "text/plain; charset=utf-8",
    "rights": {
      "access": "open",
      "holder": null,
      "license": "https://creativecommons.org/publicdomain/mark/1.0/",
      "note": "Ancient work: public domain. Text from Chinese Wikisource."
    },
    "source_ref": null,
    "source_sha256": "81a81ee712e0186cfc5b620aa14271523df036e91afbf0fc93bc72d48974e6fd",
    "title": "論語",
    "unit_count": 2,
    "updated": "2026-10-07T00:00:00Z",
    "year": null
  },
  "extensions": [],
  "figures": [],
  "fragments": [
    {
      "anchor": {
        "chars": [0, 41],
        "ref": "1.1",
        "scheme": "analects",
        "type": "canonical"
      },
      "anchor_end": null,
      "context": "論語·學而第一",
      "id": "lunyu-1.1",
      "n": 1,
      "ord": 1,
      "search_text": "",
      "section": ["學而第一"],
      "text": "子曰：「學而時習之，不亦說乎？有朋自遠方來，不亦樂乎？人不知而不慍，不亦君子乎？」",
      "unit": "b1"
    },
    {
      "anchor": {
        "chars": [42, 103],
        "ref": "1.2",
        "scheme": "analects",
        "type": "canonical"
      },
      "anchor_end": null,
      "context": "論語·學而第一",
      "id": "lunyu-1.2",
      "n": 2,
      "ord": 2,
      "search_text": "",
      "section": ["學而第一"],
      "text": "有子曰：「其爲人也孝弟，而好犯上者，鮮矣；不好犯上，而好作亂者，未之有也。君子務本，本立而道生；孝弟也者，其爲仁之本與？」",
      "unit": "b1"
    },
    {
      "anchor": {
        "chars": [104, 118],
        "ref": "1.3",
        "scheme": "analects",
        "type": "canonical"
      },
      "anchor_end": null,
      "context": "論語·學而第一",
      "id": "lunyu-1.3",
      "n": 3,
      "ord": 3,
      "search_text": "",
      "section": ["學而第一"],
      "text": "子曰：「巧言令色，鮮矣仁。」",
      "unit": "b1"
    },
    {
      "anchor": {
        "chars": [119, 154],
        "ref": "1.4",
        "scheme": "analects",
        "type": "canonical"
      },
      "anchor_end": null,
      "context": "論語·學而第一",
      "id": "lunyu-1.4",
      "n": 4,
      "ord": 4,
      "search_text": "",
      "section": ["學而第一"],
      "text": "曾子曰：「吾日三省吾身：爲人謀而不忠乎？與朋友交而不信乎？傳不習乎？」",
      "unit": "b1"
    },
    {
      "anchor": {
        "chars": [0, 25],
        "ref": "2.1",
        "scheme": "analects",
        "type": "canonical"
      },
      "anchor_end": null,
      "context": "論語·爲政第二",
      "id": "lunyu-2.1",
      "n": 5,
      "ord": 5,
      "search_text": "",
      "section": ["爲政第二"],
      "text": "子曰：「爲政以德，譬如北辰，居其所，而眾星共之。」",
      "unit": "b2"
    },
    {
      "anchor": {
        "chars": [26, 45],
        "ref": "2.15",
        "scheme": "analects",
        "type": "canonical"
      },
      "anchor_end": null,
      "context": "論語·爲政第二",
      "id": "lunyu-2.15",
      "n": 6,
      "ord": 6,
      "search_text": "",
      "section": ["爲政第二"],
      "text": "子曰：「學而不思則罔，思而不學則殆。」",
      "unit": "b2"
    }
  ],
  "fts": {
    "tokenizer": "unicode61 remove_diacritics 2",
    "trigram": true
  },
  "meta": {
    "created": "2026-10-07T00:00:00Z",
    "document_id": "lunyu",
    "generator": "spdf-conformance/1.0",
    "profile": "core",
    "spdf_version": "5.0"
  },
  "provenance": [
    {
      "at": "2026-10-07T00:00:00Z",
      "detail": {
        "accessed": "2026-10-07",
        "edition": "Wikisource (zh) collaborative text of 論語, chapters 學而第一 and 爲政第二",
        "license": "Text: public domain; Wikisource text under CC BY-SA 4.0",
        "pages": [
          {
            "revision": 11118093,
            "title": "論語/學而第一",
            "url": "https://zh.wikisource.org/w/index.php?oldid=11118093"
          },
          {
            "revision": 11118094,
            "title": "論語/爲政第二",
            "url": "https://zh.wikisource.org/w/index.php?oldid=11118094"
          }
        ]
      },
      "model": null,
      "ms": null,
      "provider": "Wikisource",
      "stage": "source-text"
    }
  ],
  "sections": [],
  "spaces": [],
  "spdf_version": "5.0",
  "units": [
    {
      "anchor": {
        "paragraph": 1,
        "path": ["學而第一"],
        "type": "section"
      },
      "confidence": 1,
      "footer": null,
      "header": null,
      "id": "b1",
      "image": null,
      "notes": null,
      "ord": 1,
      "printed": null,
      "reader": "wikisource-transcription",
      "t0": null,
      "t1": null,
      "text": "子曰：「學而時習之，不亦說乎？有朋自遠方來，不亦樂乎？人不知而不慍，不亦君子乎？」\n有子曰：「其爲人也孝弟，而好犯上者，鮮矣；不好犯上，而好作亂者，未之有也。君子務本，本立而道生；孝弟也者，其爲仁之本與？」\n子曰：「巧言令色，鮮矣仁。」\n曾子曰：「吾日三省吾身：爲人謀而不忠乎？與朋友交而不信乎？傳不習乎？」",
      "thumbnail": null,
      "words": null
    },
    {
      "anchor": {
        "paragraph": 1,
        "path": ["爲政第二"],
        "type": "section"
      },
      "confidence": 1,
      "footer": null,
      "header": null,
      "id": "b2",
      "image": null,
      "notes": null,
      "ord": 2,
      "printed": null,
      "reader": "wikisource-transcription",
      "t0": null,
      "t1": null,
      "text": "子曰：「爲政以德，譬如北辰，居其所，而眾星共之。」\n子曰：「學而不思則罔，思而不學則殆。」",
      "thumbnail": null,
      "words": null
    }
  ],
  "vectors": {}
}
